{
  "$schema": "./schemas/vendors.schema.json",
  "version": 1,
  "updated": "2026-09-10",
  "administrators": [
    "Maria-Startseva"
  ],
  "vendors": [
    {
      "id": "ibm",
      "displayName": "IBM",
      "status": "active",
      "homepage": "https://www.ibm.com",
      "github": {
        "host": "github.com",
        "org": "IBM",
        "repos": [
          "ibm-watsonx-orchestrate-adk",
          "ui-modernization-lab"
        ]
      },
      "extraSources": [
        "https://github.ibm.com/tech-garage-spgi/excel-to-wxo",
        "https://github.com/carbon-design-system",
        "https://github.com/ibm-self-serve-assets"
      ],
      "maintainers": [
        "Maria-Startseva"
      ],
      "publicKey": null,
      "networkAllow": [
        "*.ibm.com",
        "ibm.com",
        "pypi.org",
        "files.pythonhosted.org",
        "github.com",
        "raw.githubusercontent.com",
        "github.ibm.com",
        "cdn.jsdelivr.net",
        "cdnjs.cloudflare.com",
        "registry.npmjs.org",
        "fonts.googleapis.com",
        "fonts.gstatic.com"
      ],
      "notes": "IBM products (watsonx Orchestrate ADK, UI modernization, Carbon, Client Engineering building blocks) and the marketplace team's own accelerators. Packs are curated by the marketplace team from these official repositories with recorded provenance."
    },
    {
      "id": "anthropic",
      "displayName": "Anthropic",
      "status": "active",
      "homepage": "https://www.anthropic.com",
      "github": {
        "host": "github.com",
        "org": "anthropics",
        "repos": [
          "skills"
        ]
      },
      "maintainers": [
        "Maria-Startseva"
      ],
      "publicKey": null,
      "networkAllow": [
        "*.anthropic.com",
        "*.claude.com",
        "modelcontextprotocol.io",
        "*.modelcontextprotocol.io",
        "pypi.org",
        "files.pythonhosted.org",
        "registry.npmjs.org",
        "github.com",
        "raw.githubusercontent.com"
      ],
      "notes": "Curated from the public anthropics/skills repository. Only the Apache-2.0 skills are eligible; the document skills (docx, pdf, pptx, xlsx) are source-available with a no-copy licence and stay out of the registry."
    },
    {
      "id": "openai",
      "displayName": "OpenAI",
      "status": "active",
      "homepage": "https://openai.com",
      "github": {
        "host": "github.com",
        "org": "openai",
        "repos": [
          "skills"
        ]
      },
      "maintainers": [
        "Maria-Startseva"
      ],
      "publicKey": null,
      "networkAllow": [
        "*.openai.com",
        "pypi.org",
        "files.pythonhosted.org",
        "registry.npmjs.org",
        "github.com",
        "raw.githubusercontent.com"
      ],
      "notes": "Curated from the Codex skills catalog (openai/skills). Each skill carries its own LICENSE.txt; only Apache-2.0 skills are taken."
    },
    {
      "id": "google",
      "displayName": "Google",
      "status": "active",
      "homepage": "https://developers.google.com",
      "github": {
        "host": "github.com",
        "org": "google",
        "repos": [
          "skills"
        ]
      },
      "maintainers": [
        "Maria-Startseva"
      ],
      "publicKey": null,
      "networkAllow": [
        "*.google.com",
        "*.googleapis.com",
        "*.cloud.google.com",
        "*.google.dev",
        "*.withgoogle.com",
        "pypi.org",
        "files.pythonhosted.org",
        "github.com",
        "raw.githubusercontent.com"
      ],
      "notes": "Curated from google/skills (Apache-2.0): agent skills for Google Cloud, Gemini, Ads and Analytics."
    },
    {
      "id": "hashicorp",
      "displayName": "HashiCorp",
      "status": "active",
      "homepage": "https://www.hashicorp.com",
      "github": {
        "host": "github.com",
        "org": "hashicorp",
        "repos": [
          "agent-skills"
        ]
      },
      "maintainers": [
        "Maria-Startseva"
      ],
      "publicKey": null,
      "networkAllow": [
        "*.hashicorp.com",
        "registry.terraform.io",
        "releases.hashicorp.com",
        "github.com",
        "raw.githubusercontent.com"
      ],
      "notes": "Curated from hashicorp/agent-skills (MPL-2.0): Terraform and Packer skills."
    },
    {
      "id": "microsoft",
      "displayName": "Microsoft",
      "status": "active",
      "homepage": "https://learn.microsoft.com",
      "github": {
        "host": "github.com",
        "org": "microsoft",
        "repos": [
          "skills"
        ]
      },
      "maintainers": [
        "Maria-Startseva"
      ],
      "publicKey": null,
      "networkAllow": [
        "*.microsoft.com",
        "*.azure.com",
        "*.azure.net",
        "*.windows.net",
        "*.nuget.org",
        "registry.npmjs.org",
        "pypi.org",
        "files.pythonhosted.org",
        "github.com",
        "raw.githubusercontent.com"
      ],
      "notes": "Curated from microsoft/skills (MIT): Azure operations and SDK skills shipped as Claude Code plugins under .github/plugins/."
    }
  ],
  "signature": null
}
